id,t
78,กฺอละ ฮาซา ฟิรอกฺุ บัยนี วะบัยนิก  ^  สะอุนับบิอุกะ บิตะอ์วีลิ มา ลัม ตัสตะฏิอฺ์ อฺะลัยฮิ ศ็อบรอ
79,อัมมัส สะฟีนะตุ ฟะกานัต ลิมะสากีนะ ยะอฺ์มะลูนะ ฟิล บะห์ริ ฟะอะร็อตตุ อัน อะอฺีบะฮา วะกานะ วะรออะฮุม มะลิกุย ยะอ์คุซุ กุลละ สะฟีนะติน ฆ็อศบา
80,วะอัมมัล ฆุลามุ ฟะกานะ อะบะวาฮุ มุอ์มินัยนิ ฟะเคาะชีนา อัย ยุรฮิเกฺาะฮุมา ฏุฆยาเนา วะกุฟรอ
81,ฟะอะร็อดนา อัย ยุบดิละฮุมา ร็อบบุฮุมา ค็อยร็อม มินฮุ ซะกาเตา วะอักฺเราะบะ รุห์มา
82,วะอัมมัล ญิดารุ ฟะกานะ ลิฆุลามัยนิ ยะตีมัยนิ ฟิล มะดีนะติ วะกานะ ตะห์ตะฮู กันซุล ละฮุมา วะกานะ อะบูฮุมา ศอลิฮัน ฟะอะรอดะ ร็อบบุกะ อัย ยับลุฆอ อะชุดดะฮุมา วะยัสตัคริญา กันซะฮุมา เราะห์มะตัม มิร ร็อบบิก  ^  วะมา ฟะอฺัลตุฮู อฺัน อัมรี  ^  ซาลิกะ ตะอ์วีลุ มา ลัม ตัสฏิอฺ์ อฺะลัยฮิ ศ็อบรอ
83,วะยัสอะลูนะกะ อฺัน ซิล กฺ็อรนัยน์  ^  กฺุล สะอัตลู อฺะลัยกุม มินฮุ ซิกรอ
84,อินนา มักกันนา ละฮู ฟิล อัรฎิ วะอาตัยนาฮุ มิน กุลลิ ชัยอิน สะบะบา
85,ฟะอัตบะอฺะ สะบะบา
86,ฮัตตา อิซา บะละเฆาะ มัฆริบัช ชัมสิ วะญะดะฮา ตัฆรุบุ ฟี อฺัยนิน ฮะมิอะติว วะวะญะดะ อฺินดะฮา เกฺอ์ามา  ^  กฺุลนา ยาซัล กฺ็อรนัยนิ อิมมา อัน ตุอฺัซซิบะ วะอิมมา อัน ตัตตะคิซะ ฟีฮิม ฮุสนา
87,กฺอละ อัมมา มัน เซฺาะละมะ ฟะเสาฟะ นุอฺัซซิบุฮู ษุมมะ ยุร็อดดุ อิลา ร็อบบิฮี ฟะยุอฺัซซิบุฮู อฺะซาบัน นุกรอ
88,วะอัมมา มัน อามะนะ วะอฺะมิละ ศอลิฮัน ฟะละฮู ญะซาอะนิล ฮุสนา  ^  วะสะนะกฺูลุ ละฮู มิน อัมรินา ยุสรอ
89,ษุมมะ อัตบะอฺะ สะบะบา
90,ฮัตตา อิซา บะละเฆาะ มัฏลิอฺัช ชัมสิ วะญะดะฮา ตัฏลุอฺุ อฺะลา เกฺอ์ามิล ลัม นัจญ์อฺัล ละฮุม มิน ดูนิฮา สิตรอ
91,กะซาลิก  ^  วะกฺ็อด อะฮัฏนา บิมา ละดัยฮิ คุบรอ
92,ษุมมะ อัตบะอฺะ สะบะบา
93,ฮัตตา อิซา บะละเฆาะ บัยนัส สัดดัยนิ วะญะดะ มิน ดูนิฮิมา เกฺอ์ามัล ลา ยะกาดูนะ ยัฟเกฺาะฮูนะ เกฺอ์าลา
94,กฺอลู ยาซัล กฺ็อรนัยนิ อินนะ ยะอ์ญูญะ วะมะอ์ญูญะ มุฟสิดูนะ ฟิล อัรฎิ ฟะฮัล นัจญ์อฺะลุ ละกะ ค็อรญัน อฺะลา อัน ตัจญ์อฺะละ บัยนะนา วะบัยนะฮุม สัดดา
95,กฺอละ มา มักกันนี ฟีฮิ ร็อบบี ค็อยรุน ฟะอะอฺีนูนี บิกฺูว์วะติน อัจญ์อฺัล บัยนะกุม วะบัยนะฮุม ร็อดมา
96,อาตูนี ซุบะร็อล ฮะดีด  ^  ฮัตตา อิซา สาวา บัยนัศ เศาะดะฟัยนิ กฺอลัน ฟุคู  ^  ฮัตตา อิซา ญะอฺะละฮู นาร็อน กฺอละ อาตูนี อุฟริฆ อฺะลัยฮิ กฺิฏรอ
97,ฟะมัส ฏออฺู อัย ยัซฺฮะรูฮุ วะมัส ตะฏออฺู ละฮู นักฺบา
98,กฺอละ ฮาซา เราะห์มะตุม มิร ร็อบบี  ^  ฟะอิซา ญาอะ วะอฺ์ดุ ร็อบบี ญะอฺะละฮู ดักกาอ์  ^  วะกานะ วะอฺ์ดุ ร็อบบี ฮักฺกฺอ
99,วะตะร็อกนา บะอฺ์เฎาะฮุม เยามะอิซี ยะมูญุ ฟี บะอฺ์ฎ์  ^  วะนุฟิเคาะ ฟิศ ศูริ ฟะญะมะอฺ์นาฮุม ญัมอฺา
100,วะอฺะร็อฎนา ญะฮันนะมะ เยามะอิซิล ลิลกาฟิรีนะ อฺัรฎอ
101,อัลละซีนะ กานัต อะอฺ์ยุนุฮุม ฟี ฆิฏออิน อฺัน ซิกรี วะกานู ลา ยัสตะฏีอฺูนะ สัมอฺา
102,อะฟะฮะสิบัล ละซีนะ กะฟะรู อัย ยัตตะคิซู อฺิบาดี มิน ดูนี เอาลิยาอ์  ^  อินนา อะอฺ์ตัดนา ญะฮันนะมะ ลิลกาฟิรีนะ นุซุลา
103,กฺุล ฮัล นุนับบิอุกุม บิลอัคสะรีนะ อะอฺ์มาลา
104,อัลละซีนะ ฎ็อลละ สะอฺ์ยุฮุม ฟิล ฮะยาติด ดุนยา วะฮุม ยะห์สะบูนะ อันนะฮุม ยุห์สินูนะ ศุนอฺา
105,อุลาอิกัล ละซีนะ กะฟะรู บิอายาติ ร็อบบิฮิม วะลิกฺออิฮี ฟะฮะบิฏ็อต อะอฺ์มาลุฮุม ฟะลา นุกฺีมุ ละฮุม เยามัล กฺิยามะติ วัซนา
106,ซาลิกะ ญะซาอุฮุม ญะฮันนะมุ บิมา กะฟะรู วัตตะเคาะซู อายาตี วะรุสุลี ฮุซุวา
107,อินนัล ละซีนะ อามะนู วะอฺะมิลุศ ศอลิฮาติ กานัต ละฮุม ญันนาตุล ฟิรเดาสิ นุซุลา
108,คอลิดีนะ ฟีฮา ลา ยับฆูนะ อฺันฮา ฮิวะลา
109,กฺุล เลา กานัล บะห์รุ มิดาดัล ลิกะลิมาติ ร็อบบี ละนะฟิดัล บะห์รุ กฺ็อบละ อัน ตันฟะดะ กะลิมาตุ ร็อบบี วะเลา ญิอ์นา บิมิษลิฮี มะดะดา
110,กฺุล อินนะมา อะนะ บะชะรุม มิษลุกุม ยูฮา อิลัยยะ อันนะมา อิลาฮุกุม อิลาฮู วาฮิด  ^  ฟะมัน กานะ ยัรญู ลิกฺออะ ร็อบบิฮี ฟัลยะอฺ์มัล อฺะมะลัน ศอลิเฮา วะลา ยุชริก บิอฺิบาดะติ ร็อบบิฮี อะฮะดา
