id,t
1,ตะบาเราะกัล ละซี นัซซะลัล ฟุรกฺอนะ อฺะลา อฺับดิฮี ลิยะกูนะ ลิลอฺาละมีนะ นะซีรอ
2,อัลละซี ละฮู มุลกุส สะมาวาติ วัลอัรฎิ วะลัม ยัตตะคิซ วะละเดา วะลัม ยะกุล ละฮู ชะรีกุน ฟิล มุลกิ วะเคาะละเกฺาะ กุลละ ชัยอิน ฟะกฺ็อดดะเราะฮู ตักฺดีรอ
3,วัตตะเคาะซู มิน ดูนิฮี อาลิฮะตัล ลา ยัคลุกฺูนะ ชัยเอา วะฮุม ยุคละกฺูนะ วะลา ยัมลิกูนะ ลิอันฟุสิฮิม ฎ็อรเรอ์า วะลา นัฟเอฺา วะลา ยัมลิกูนะ เมาเตา วะลา ฮะยาเตา วะลา นุชูรอ
4,วะกฺอลัล ละซีนะ กะฟะรู อิน ฮาซา อิลลา อิฟกุนิฟ ตะรอฮุ วะอะอฺานะฮู อฺะลัยฮิ เกฺอ์ามุน อาเคาะรูน  ^  ฟะกฺ็อด ญาอู ซฺุลเมา วะซูรอ
5,วะกฺอลู อะสาฏีรุล เอาวะลีนัก ตะตะบะฮา ฟะฮิยะ ตุมลา อฺะลัยฮิ บุกเราะเตา วะอะศีลา
6,กฺุล อันซะละฮุล ละซี ยะอฺ์ละมุส สิรเราะ ฟิส สะมาวาติ วัลอัรฎ์  ^  อินนะฮู กานะ เฆาะฟูร็อร เราะฮีมา
7,วะกฺอลู มาลิ ฮาซัร เราะสูลิ ยะอ์กุลุฏ เฏาะอฺามะ วะยัมชี ฟิล อัสวากฺิ เลาลา อุนซิละ อิลัยฮิ มะละกุน ฟะยะกูนะ มะอฺะฮู นะซีรอ
8,เอา ยุลกฺอ อิลัยฮิ กันซุน เอา ตะกูนุ ละฮู ญันนะตุย ยะอ์กุลุ มินฮา  ^  วะกฺอลัซฺ ซฺอลิมูนะ อิน ตัตตะบิอฺูนะ อิลลา เราะญุลัม มัสฮูรอ
9,อินซฺุร กัยฟะ เฎาะเราะบู ละกัล อัมษาละ ฟะฎ็อลลู ฟะลา ยัสตะฏีอฺูนะ สะบีลา
10,ตะบาเราะกัล ละซี อิน ชาอะ ญะอฺะละ ละกะ ค็อยร็อม มิน ซาลิกะ ญันนาติน ตัจญ์รี มิน ตะห์ติฮัล อันฮารุ วะยัจญ์อฺัล ละกะ กฺุศูรอ
11,บัล กัซซะบู บิสสาอฺะฮ์  ^  วะอะอฺ์ตัดนา ลิมัน กัซซะบะ บิสสาอฺะติ สะอฺีรอ
12,อิซา เราะอัตฮุม มิม มะกานิม บะอฺีดิน สะมิอฺู ละฮา ตะฆ็อยยุเซฺอ์า วะซะฟีรอ
13,วะอิซา อุลกฺู มินฮา มะกานัน ฎ็อยยิกฺ็อม มุกฺ็อรเราะนีนะ ดะเอฺา ฮุนาลิกะ ษุบูรอ
14,ลา ตัดอฺุล เยามะ ษุบูเรอ์า วาฮิเดา วัดอฺู ษุบูร็อน กะษีรอ
15,กฺุล อะซาลิกะ ค็อยรุน อัม ญันนะตุล คุลดิล ละตี วุอฺิดัล มุตตะกฺูน  ^  กานัต ละฮุม ญะซาเอา วะมะศีรอ
16,ละฮุม ฟีฮา มา ยะชาอูนะ คอลิดีน  ^  กานะ อฺะลา ร็อบบิกะ วะอฺ์ดัม มัสอูลา
17,วะเยามะ ยะห์ชุรุฮุม วะมา ยะอฺ์บุดูนะ มิน ดูนิล ลาฮิ ฟะยะกฺูลุ อะอันตุม อัฎลัลตุม อฺิบาดี ฮาอุลาอิ อัม ฮุม ฎ็อลลุส สะบีล
18,กฺอลู สุบฮานะกะ มา กานะ ยัมบะฆี ละนา อัน นัตตะคิซะ มิน ดูนิกะ มิน เอาลิยาอะ วะลากิม มัตตะอฺ์ตะฮุม วะอาบาอะฮุม ฮัตตา นะสุซ ซิกเราะ วะกานู เกฺอ์ามัม บูรอ
19,ฟะกฺ็อด กัซซะบูกุม บิมา ตะกฺูลูนะ ฟะมา ตัสตะฏีอฺูนะ ศ็อรเฟา วะลา นัศรอ  ^  วะมัย ยัซฺลิม มินกุม นุซิกฺฮุ อฺะซาบัน กะบีรอ
20,วะมา อัรสัลนา กฺ็อบละกะ มินัล มุรสะลีนะ อิลลา อินนะฮุม ละยะอ์กุลูนัฏ เฏาะอฺามะ วะยัมชูนะ ฟิล อัสวากฺ  ^  วะญะอฺัลนา บะอฺ์เฎาะกุม ลิบะอฺ์ฎิน ฟิตนะตัน อะตัศบิรูน  ^  วะกานะ ร็อบบุกะ บะศีรอ
21,วะกฺอลัล ละซีนะ ลา ยัรญูนะ ลิกฺออะนา เลาลา อุนซิละ อฺะลัยนัล มะลาอิกะตุ เอา นะรอ ร็อบบะนา  ^  ละเกฺาะดิส ตักบะรู ฟี อันฟุสิฮิม วะอฺะเตา อฺุตูว์วัน กะบีรอ
22,เยามะ ยะเรอ์านัล มะลาอิกะตะ ลา บุชรอ เยามะอิซิล ลิลมุจญ์ริมีนะ วะยะกฺูลูนะ ฮิจญ์ร็อม มะห์ญูรอ
23,วะเกฺาะดิมนา อิลา มา อฺะมิลู มิน อฺะมะลิน ฟะญะอฺัลนาฮุ ฮะบาอัม มันษูรอ
24,อัศฮาบุล ญันนะติ เยามะอิซิน ค็อยรุม มุสตะกฺ็อรเรอ์า วะอะห์สะนุ มะกฺีลา
25,วะเยามะ ตะชักฺเกฺาะกฺุส สะมาอุ บิลเฆาะมามิ วะนุซซิลัล มะลาอิกะตุ ตันซีลา
26,อัลมุลกุ เยามะอิซินิล ฮักฺกฺุ ลิรเราะห์มาน  ^  วะกานะ เยามัน อฺะลัล กาฟิรีนะ อฺะสีรอ
27,วะเยามะ ยะอฺัฎฎุซฺ ซฺอลิมุ อฺะลา ยะดัยฮิ ยะกฺูลุ ยาลัยตะนิต ตะค็อซตุ มะอฺัร เราะสูลิ สะบีลา
28,ยาวัยละตา ลัยตะนี ลัม อัตตะคิซ ฟุลานัน เคาะลีลา
29,ละกฺ็อด อะฎ็อลละนี อฺะนิซ ซิกริ บะอฺ์ดะ อิซ ญาอะนี  ^  วะกานัช ชัยฏอนุ ลิลอินสานิ เคาะซูลา
30,วะกฺอลัร เราะสูลุ ยาร็อบบิ อินนะ เกฺอ์ามิต ตะเคาะซู ฮาซัล กฺุรอานะ มะฮ์ญูรอ
31,วะกะซาลิกะ ญะอฺัลนา ลิกุลลิ นะบีย์ยิน อฺะดูว์วัม มินัล มุจญ์ริมีน  ^  วะกะฟา บิร็อบบิกะ ฮาดิเยา วะนะศีรอ
32,วะกฺอลัล ละซีนะ กะฟะรู เลาลา นุซซิละ อฺะลัยฮิล กฺุรอานุ ญุมละเตา วาฮิดะฮ์  ^  กะซาลิกะ ลินุษับบิตะ บิฮี ฟุอาดัก  ^  วะร็อตตัลนาฮุ ตัรตีลา
33,วะลา ยะอ์ตูนะกะ บิมะษะลิน อิลลา ญิอ์นากะ บิลฮักฺกฺิ วะอะห์สะนะ ตัฟสีรอ
34,อัลละซีนะ ยุห์ชะรูนะ อฺะลา วุญูฮิฮิม อิลา ญะฮันนะมะ อุลาอิกะ ชัรรุม มะกาเนา วะอะฎ็อลลุ สะบีลา
35,วะละกฺ็อด อาตัยนา มูสัล กิตาบะ วะญะอฺัลนา มะอฺะฮู อะคอฮุ ฮารูนะ วะซีรอ
36,ฟะกฺุลนัซ ฮะบา อิลัล เกฺอ์ามิล ละซีนะ กัซซะบู บิอายาตินา ฟะดัมมัรนาฮุม ตัดมีรอ
37,วะเกฺอ์ามะ นูฮิล ลัมมา กัซซะบุร รุสุละ อัฆร็อกฺนาฮุม วะญะอฺัลนาฮุม ลินนาสิ อายะฮ์  ^  วะอะอฺ์ตัดนา ลิซฺซฺอลิมีนะ อฺะซาบัน อะลีมา
38,วะอฺาเดา วะษะมูดะ วะอัศฮาบัร ร็อสสิ วะกฺุรูนัม บัยนะ ซาลิกะ กะษีรอ
39,วะกุลลัน เฎาะร็อบนา ละฮุล อัมษาล  ^  วะกุลลัน ตับบัรนา ตัตบีรอ
40,วะละกฺ็อด อะเตา อฺะลัล กฺ็อรยะติล ละตี อุมฏิร็อต มะเฏาะร็อส เสาอ์  ^  อะฟะลัม ยะกูนู ยะเรอ์านะฮา  ^  บัล กานู ลา ยัรญูนะ นุชูรอ
41,วะอิซา เราะเอากะ อี ยัตตะคิซูนะกะ อิลลา ฮุซุวัน อะฮาซัล ละซี บะอฺะษัล ลอฮุ เราะสูลา
42,อิน กาดะ ละยุฎิลลุนา อฺัน อาลิฮะตินา เลาลา อัน เศาะบัรนา อฺะลัยฮา  ^  วะเสาฟะ ยะอฺ์ละมูนะ ฮีนะ ยะเรอ์านัล อฺะซาบะ มัน อะฎ็อลลุ สะบีลา
43,อะเราะอัยตะ มะนิต ตะเคาะซะ อิลาฮะฮู ฮะวาฮุ อะฟะอันตะ ตะกูนุ อฺะลัยฮิ วะกีลา
44,อัม ตะห์สะบุ อันนะ อักษะเราะฮุม ยัสมะอฺูนะ เอา ยะอฺ์กฺิลูน  ^  อิน ฮุม อิลลา กัลอันอฺามิ บัล ฮุม อะฎ็อลลุ สะบีลา
45,อะลัม ตะเราะ อิลา ร็อบบิกะ กัยฟะ มัดดัซฺ ซฺิลละ วะเลา ชาอะ ละญะอฺะละฮู สากินัน ษุมมะ ญะอฺัลนัช ชัมสะ อฺะลัยฮิ ดะลีลา
46,ษุมมะ เกฺาะบัฎนาฮุ อิลัยนา กฺ็อบฎ็อย ยะสีรอ
47,วะฮุวัล ละซี ญะอฺะละ ละกุมุล ลัยละ ลิบาเสา วันเนามะ สุบาเตา วะญะอฺะลัน นะฮาเราะ นุชูรอ
48,วะฮุวัล ละซี อัรสะลัร ริยาฮะ บุชร็อม บัยนะ ยะดัย เราะห์มะติฮ์  ^  วะอันซัลนา มินัส สะมาอิ มาอัน เฏาะฮูรอ
49,ลินุห์ยิยะ บิฮี บัลดะตัม มัยเตา วะนุสกฺิยะฮู มิมมา เคาะลักฺนา อันอฺาเมา วะอะนาสีย์ยะ กะษีรอ
50,วะละกฺ็อด ศ็อรร็อฟนาฮุ บัยนะฮุม ลิยัซซักกะรู ฟะอะบา อักษะรุน นาสิ อิลลา กุฟูรอ
51,วะเลา ชิอ์นา ละบะอฺัษนา ฟี กุลลิ กฺ็อรยะติน นะซีรอ
52,ฟะลา ตุฏิอฺิล กาฟิรีนะ วะญาฮิดฮุม บิฮี ญิฮาดัน กะบีรอ
53,วะฮุวัล ละซี มะเราะญัล บะห์ร็อยนิ ฮาซา อฺัซบุน ฟุรอตู วะฮาซา มิลฮุน อุญาญู วะญะอฺะละ บัยนะฮุมา บัรซะเคอ์า วะฮิจญ์ร็อม มะห์ญูรอ
54,วะฮุวัล ละซี เคาะละเกฺาะ มินัล มาอิ บะชะร็อน ฟะญะอฺะละฮู นะสะเบา วะศิฮ์รอ  ^  วะกานะ ร็อบบุกะ เกฺาะดีรอ
55,วะยะอฺ์บุดูนะ มิน ดูนิล ลาฮิ มา ลา ยันฟะอฺุฮุม วะลา ยะฎุรรุฮุม  ^  วะกานัล กาฟิรุ อฺะลา ร็อบบิฮี เซฺาะฮีรอ
56,วะมา อัรสัลนากะ อิลลา มุบัชชิเรอ์า วะนะซีรอ
57,กฺุล มา อัสอะลุกุม อฺะลัยฮิ มิน อัจญ์ริน อิลลา มัน ชาอะ อัย ยัตตะคิซะ อิลา ร็อบบิฮี สะบีลา
58,วะตะวักกัล อฺะลัล ฮัยยิล ละซี ลา ยะมูตุ วะสับบิห์ บิฮัมดิฮ์  ^  วะกะฟา บิฮี บิซุนูบิ อฺิบาดิฮี เคาะบีรอ
59,อัลละซี เคาะละกฺ็อส สะมาวาติ วัลอัรเฎาะ วะมา บัยนะฮุมา ฟี สิตตะติ อัยยามิน ษุมมัส ตะวา อฺะลัล อฺัรช์  ^  อัรเราะห์มานุ ฟัสอัล บิฮี เคาะบีรอ
60,วะอิซา กฺีละ ละฮุมุส ญุดู ลิรเราะห์มานิ กฺอลู วะมัร เราะห์มานุ อะนัสญุดุ ลิมา ตะอ์มุรุนา วะซาดะฮุม นุฟูรอ
61,ตะบาเราะกัล ละซี ญะอฺะละ ฟิส สะมาอิ บุรูเญา วะญะอฺะละ ฟีฮา สิรอเญา วะเกฺาะมะร็อม มุนีรอ
62,วะฮุวัล ละซี ญะอฺะลัล ลัยละ วันนะฮาเราะ คิลฟะตัล ลิมัน อะรอดะ อัย ยัซซักกะเราะ เอา อะรอดะ ชุกูรอ
63,วะอฺิบาดุร เราะห์มานิล ละซีนะ ยัมชูนะ อฺะลัล อัรฎิ เฮาเนา วะอิซา คอเฏาะบะฮุมุล ญาฮิลูนะ กฺอลู สะลามา
64,วัลละซีนะ ยะบีตูนะ ลิร็อบบิฮิม สุจญ์ญะเดา วะกฺิยามา
65,วัลละซีนะ ยะกฺูลูนะ ร็อบบะนัศ ริฟ อฺันนา อฺะซาบะ ญะฮันนัม  ^  อินนะ อฺะซาบะฮา กานะ เฆาะรอมา
66,อินนะฮา สาอัต มุสตะกฺ็อรเรอ์า วะมุกฺอมา
67,วัลละซีนะ อิซา อันฟะกฺู ลัม ยุสริฟู วะลัม ยักฺตุรู วะกานะ บัยนะ ซาลิกะ เกฺาะวามา
68,วัลละซีนะ ลา ยัดอฺูนะ มะอฺัล ลอฮิ อิลาฮัน อาเคาะเราะ วะลา ยักฺตุลูนัน นัฟสัล ละตี ฮัรเราะมัล ลอฮุ อิลลา บิลฮักฺกฺิ วะลา ยัซนูน  ^  วะมัย ยัฟอฺัล ซาลิกะ ยัลเกฺาะ อะษามา
69,ยุฎออฺัฟ ละฮุล อฺะซาบุ เยามัล กฺิยามะติ วะยัคลุด ฟีฮี มุฮานา
70,อิลลา มัน ตาบะ วะอามะนะ วะอฺะมิละ อฺะมะลัน ศอลิฮัน ฟะอุลาอิกะ ยุบัดดิลุล ลอฮุ สัยยิอาติฮิม ฮะสะนาต  ^  วะกานัล ลอฮุ เฆาะฟูร็อร เราะฮีมา
71,วะมัน ตาบะ วะอฺะมิละ ศอลิฮัน ฟะอินนะฮู ยะตูบุ อิลัล ลอฮิ มะตาบา
72,วัลละซีนะ ลา ยัชฮะดูนัซ ซูเราะ วะอิซา มัรรู บิลลัฆวิ มัรรู กิรอมา
73,วัลละซีนะ อิซา ซุกกิรู บิอายาติ ร็อบบิฮิม ลัม ยะคิรรู อฺะลัยฮา ศุมเมา วะอฺุมยานา
74,วัลละซีนะ ยะกฺูลูนะ ร็อบบะนา ฮับ ละนา มิน อัซวาญินา วะซุรรีย์ยาตินา กฺุรเราะตะ อะอฺ์ยุนิว วัจญ์อฺัลนา ลิลมุตตะกฺีนะ อิมามา
75,อุลาอิกะ ยุจญ์เซานัล ฆุรฟะตะ บิมา เศาะบะรู วะยุลักฺเกฺอ์านะ ฟีฮา ตะฮีย์ยะเตา วะสะลามา
76,คอลิดีนะ ฟีฮา  ^  ฮะสุนัต มุสตะกฺ็อรเรอ์า วะมุกฺอมา
77,กฺุล มา ยะอฺ์บะอุ บิกุม ร็อบบี เลาลา ดุอฺาอุกุม  ^  ฟะกฺ็อด กัซซับตุม ฟะเสาฟะ ยะกูนุ ลิซามา
