id,t
72,วะกฺอลัฏ ฏออิฟะตุม มิน อะฮ์ลิล กิตาบิ อามินู บิลละซี อุนซิละ อฺะลัล ละซีนะ อามะนู วัจญ์ฮัน นะฮาริ วักฟุรู อาคิเราะฮู ละอฺัลละฮุม ยัรญิอฺูน
73,วะลา ตุอ์มินู อิลลา ลิมัน ตะบิอฺะ ดีนะกุม กฺุล อินนัล ฮุดา ฮุดัล ลอฮิ อัย ยุอ์ตา อะฮะดุม มิษละ มา อูตีตุม เอา ยุฮา-จญ์ญูกุม อฺินดะ ร็อบบิกุม  ^  กฺุล อินนัล ฟัฎละ บิยะดิล ลาฮิ ยุอ์ตีฮิ มัย ยะชาอ์  ^  วัลลอฮุ วาสิอฺุน อฺะลีม
74,ยัคตัศศุ บิเราะห์มะติฮี มัย ยะชาอ์  ^  วัลลอฮุ ซุล ฟัฎลิล อฺะซฺีม
75,วะมิน อะฮ์ลิล กิตาบิ มัน อิน ตะอ์มันฮุ บิกฺินฏอรี ยุอัดดิฮี อิลัยกะ วะมินฮุม มัน อิน ตะอ์มันฮุ บิดีนาริล ลา ยุอัดดิฮี อิลัยกะ อิลลา มา ดุมตะ อฺะลัยฮิ กฺออิมา  ^  ซาลิกะ บิอันนะฮุม กฺอลู ลัยสะ อฺะลัยนา ฟิล อุมมีย์ยินะ สะบีลู วะยะกฺูลูนะ อฺะลัล ลอฮิล กะซิบะ วะฮุม ยะอฺ์ละมูน
76,บะลา  ^  มัน เอาฟา บิอฺะฮ์ดิฮี วัตตะกฺอ ฟะอินนัล ลอฮะ ยุฮิบบุล มุตตะกฺีน
77,อินนัล ละซีนะ ยัชตะรูนะ บิอฺะฮ์ดิล ลาฮิ วะอัยมานิฮิม ษะมะนัน เกฺาะลีลัน อุลาอิกะ ลา เคาะลาเกฺาะ ละฮุม ฟิล อาคิเราะติ วะลา ยุกัลลิมุฮุมุล ลอฮุ วะลา ยันซฺุรุ อิลัยฮิม เยามัล กฺิยามะติ วะลา ยุซักกีฮิม วะละฮุม อฺะซาบุน อะลีม
78,วะอินนะ มินฮุม ละฟะรีกฺ็อย ยัลวูนะ อัลสินะตะฮุม บิลกิตาบิ ลิตะห์สะบูฮุ มินัล กิตาบิ วะมา ฮุวะ มินัล กิตาบิ วะยะกฺูลูนะ ฮุวะ มิน อฺินดิล ลาฮิ วะมา ฮุวะ มิน อฺินดิล ลาฮิ วะยะกฺูลูนะ อฺะลัล ลอฮิล กะซิบะ วะฮุม ยะอฺ์ละมูน
79,มา กานะ ลิบะชะริน อัย ยุอ์ติยะฮุล ลอฮุล กิตาบะ วัลฮุกมะ วันนุบูว์วะตะ ษุมมะ ยะกฺูละ ลินนาสิ กูนู อฺิบาดัล ลี มิน ดูนิล ลาฮิ วะลากิน กูนู ร็อบบานีย์ยินะ บิมา กุนตุม ตุอฺัลลิมูนัล กิตาบะ วะบิมา กุนตุม ตัดรุสูน
80,วะลา ยะอ์มุเราะกุม อัน ตัตตะคิซุล มะลาอิกะตะ วันนะบีย์ยินะ อัรบาบา  ^  อะยะอ์มุรุกุม บิลกุฟริ บะอฺ์ดะ อิซ อันตุม มุสลิมูน
81,วะอิซ อะเคาะซัล ลอฮุ มีษากฺ็อน นะบีย์ยินะ ละมา อาตัยตุกุม มิน กิตาบิว วะฮิกมะติน ษุมมะ ญาอะกุม เราะสูลุม มุศ็อดดิกฺุล ลิมา มะอฺะกุม ละตุอ์มินุนนะ บิฮี วะละตันศุรุนนะฮ์  ^  กฺอละ อะอักฺร็อรตุม วะอะค็อซตุม อฺะลา ซาลิกุม อิศรี  ^  กฺอลู อักฺร็อรนา  ^  กฺอละ ฟัชฮะดู วะอะนะ มะอฺะกุม มินัช ชาฮิดีน
82,ฟะมัน ตะวัลลา บะอฺ์ดะ ซาลิกะ ฟะอุลาอิกะ ฮุมุล ฟาสิกฺูน
83,อะฟะฆ็อยเราะ ดีนิล ลาฮิ ยับฆูนะ วะละฮู อัสละมะ มัน ฟิส สะมาวาติ วัลอัรฎิ เฏอ์าเอฺา วะกัรเฮา วะอิลัยฮิ ยุรญะอฺูน
84,กฺุล อามันนา บิลลาฮิ วะมา อุนซิละ อฺะลัยนา วะมา อุนซิละ อฺะลา อิบรอฮีมะ วะอิสมาอฺีละ วะอิสฮาเกฺาะ วะยะอฺ์กฺูบะ วัลอัสบาฏิ วะมา อูติยะ มูสา วะอฺีสา วันนะบีย์ยูนะ มิร ร็อบบิฮิม ลา นุฟัรริกฺุ บัยนะ อะฮะดิม มินฮุม วะนะห์นุ ละฮู มุสลิมูน
85,วะมัย ยับตะฆิ ฆ็อยร็อล อิสลามิ ดีนัน ฟะลัย ยุกฺบะละ มินฮุ วะฮุวะ ฟิล อาคิเราะติ มินัล คอสิรีน
86,กัยฟะ ยะฮ์ดิล ลาฮุ เกฺอ์ามัน กะฟะรู บะอฺ์ดะ อีมานิฮิม วะชะฮิดู อันนัร เราะสูละ ฮักฺกฺู วะญาอะฮุมุล บัยยินาต  ^  วัลลอฮุ ลา ยะฮ์ดิล เกฺอ์ามัซฺ ซฺอลิมีน
87,อุลาอิกะ ญะซาอุฮุม อันนะ อฺะลัยฮิม ละอฺ์นะตัล ลอฮิ วัลมะลาอิกะติ วันนาสิ อัจญ์มะอฺีน
88,คอลิดีนะ ฟีฮา ลา ยุค็อฟฟะฟุ อฺันฮุมุล อฺะซาบุ วะลา ฮุม ยุนเซฺาะรูน
89,อิลลัล ละซีนะ ตาบู มิม บะอฺ์ดิ ซาลิกะ วะอัศละฮู ฟะอินนัล ลอฮะ เฆาะฟูรุร เราะฮีม
90,อินนัล ละซีนะ กะฟะรู บะอฺ์ดะ อีมานิฮิม ษุมมัซ ดาดู กุฟร็อล ลัน ตุกฺบะละ เตาบะตุฮุม วะอุลาอิกะ ฮุมุฎ ฎอ-ลลูน
91,อินนัล ละซีนะ กะฟะรู วะมาตู วะฮุม กุฟฟารุน ฟะลัย ยุกฺบะละ มิน อะฮะดิฮิม มิลอุล อัรฎิ ซะฮะเบา วะละวิฟ ตะดา บิฮ์  ^  อุลาอิกะ ละฮุม อฺะซาบุน อะลีมู วะมา ละฮุม มิน นาศิรีน
92,ลัน ตะนาลุล บิรเราะ ฮัตตา ตุนฟิกฺู มิมมา ตุฮิบบูน  ^  วะมา ตุนฟิกฺู มิน ชัยอิน ฟะอินนัล ลอฮะ บิฮี อฺะลีม
93,กุลลุฏ เฏาะอฺามิ กานะ ฮิลลัล ลิบะนี อิสรออีละ อิลลา มา ฮัรเราะมะ อิสรออีลุ อฺะลา นัฟสิฮี มิน กฺ็อบลิ อัน ตุนัซซะลัต เตารอฮ์  ^  กฺุล ฟะอ์ตู บิตเตารอติ ฟัตลูฮา อิน กุนตุม ศอดิกฺีน
94,ฟะมะนิฟ ตะรอ อฺะลัล ลอฮิล กะซิบะ มิม บะอฺ์ดิ ซาลิกะ ฟะอุลาอิกะ ฮุมุซฺ ซฺอลิมูน
95,กฺุล เศาะดะกฺ็อล ลอฮ์  ^  ฟัตตะบิอฺู มิลละตะ อิบรอฮีมะ ฮะนีฟา  ^  วะมา กานะ มินัล มุชริกีน
96,อินนะ เอาวะละ บัยติว วุฎิอฺะ ลินนาสิ ลัลละซี บิบักกะตะ มุบาเราะเกา วะฮุดัล ลิลอฺาละมีน
97,ฟีฮิ อายาตุม บัยยินาตุม มะกฺอมุ อิบรอฮีม  ^  วะมัน ดะเคาะละฮู กานะ อามินา  ^  วะลิลลาฮิ อฺะลัน นาสิ ฮิจญ์ญุล บัยติ มะนิส ตะฏออฺะ อิลัยฮิ สะบีลา  ^  วะมัน กะฟะเราะ ฟะอินนัล ลอฮะ เฆาะนีย์ยุน อฺะนิล อฺาละมีน
98,กฺุล ยาอะฮ์ลัล กิตาบิ ลิมะ ตักฟุรูนะ บิอายาติล ลาฮิ วัลลอฮุ ชะฮีดุน อฺะลา มา ตะอฺ์มะลูน
99,กฺุล ยาอะฮ์ลัล กิตาบิ ลิมะ ตะศุดดูนะ อฺัน สะบีลิล ลาฮิ มัน อามะนะ ตับฆูนะฮา อฺิวะเญา วะอันตุม ชุฮะดาอ์  ^  วะมัล ลอฮุ บิฆอฟิลิน อฺัมมา ตะอฺ์มะลูน
100,ยาอัยยุฮัล ละซีนะ อามะนู อิน ตุฏีอฺู ฟะรีกฺ็อม มินัล ละซีนะ อูตุล กิตาบะ ยะรุดดูกุม บะอฺ์ดะ อีมานิกุม กาฟิรีน
101,วะกัยฟะ ตักฟุรูนะ วะอันตุม ตุตลา อฺะลัยกุม อายาตุล ลอฮิ วะฟีกุม เราะสูลุฮ์  ^  วะมัย ยะอฺ์ตะศิม บิลลาฮิ ฟะกฺ็อด ฮุดิยะ อิลา ศิรอฏิม มุสตะกฺีม
102,ยาอัยยุฮัล ละซีนะ อามะนุต ตะกฺุล ลอฮะ ฮักฺเกฺาะ ตุกฺอติฮี วะลา ตะมูตุนนะ อิลลา วะอันตุม มุสลิมูน
103,วะอฺ์ตะศิมู บิฮับลิล ลาฮิ ญะมีเอฺา วะลา ตะฟัรเราะกฺู  ^  วัซกุรู นิอฺ์มะตัล ลอฮิ อฺะลัยกุม อิซ กุนตุม อะอฺ์ดาอัน ฟะอัลละฟะ บัยนะ กฺุลูบิกุม ฟะอัศบะห์ตุม บินิอฺ์มะติฮี อิควาเนา วะกุนตุม อฺะลา ชะฟา ฮุฟเราะติม มินัน นาริ ฟะอันเกฺาะซะกุม มินฮา  ^  กะซาลิกะ ยุบัยยินุล ลอฮุ ละกุม อายาติฮี ละอฺัลละกุม ตะฮ์ตะดูน
104,วัลตะกุม มินกุม อุมมะตุย ยัดอฺูนะ อิลัล ค็อยริ วะยะอ์มุรูนะ บิลมะอฺ์รูฟิ วะยันเฮานะ อฺะนิล มุนกัร  ^  วะอุลาอิกะ ฮุมุล มุฟลิฮูน
105,วะลา ตะกูนู กัลละซีนะ ตะฟัรเราะกฺู วัคตะละฟู มิม บะอฺ์ดิ มา ญาอะฮุมุล บัยยินาต  ^  วะอุลาอิกะ ละฮุม อฺะซาบุน อฺะซฺีม
106,เยามะ ตับยัฎฎุ วุญูฮู วะตัสวัดดุ วุญูฮ์  ^  ฟะอัมมัล ละซีนัส วัดดัต วุญูฮุฮุม อะกะฟัรตุม บะอฺ์ดะ อีมานิกุม ฟะซูกฺุล อฺะซาบะ บิมา กุนตุม ตักฟุรูน
107,วะอัมมัล ละซีนับ ยัฎฎ็อต วุญูฮุฮุม ฟะฟี เราะห์มะติล ลาฮ์  ^  ฮุม ฟีฮา คอลิดูน
108,ติลกะ อายาตุล ลอฮิ นัตลูฮา อฺะลัยกะ บิลฮักฺกฺ์  ^  วะมัล ลอฮุ ยุรีดุ ซฺุลมัล ลิลอฺาละมีน
109,วะลิลลาฮิ มา ฟิส สะมาวาติ วะมา ฟิล อัรฎ์  ^  วะอิลัล ลอฮิ ตุรญะอฺุล อุมูร
110,กุนตุม ค็อยเราะ อุมมะติน อุคริญัต ลินนาสิ ตะอ์มุรูนะ บิลมะอฺ์รูฟิ วะตันเฮานะ อฺะนิล มุนกะริ วะตุอ์มินูนะ บิลลาฮ์  ^  วะเลา อามะนะ อะฮ์ลุล กิตาบิ ละกานะ ค็อยร็อล ละฮุม  ^  มินฮุมุล มุอ์มินูนะ วะอักษะรุฮุมุล ฟาสิกฺูน
111,ลัย ยะฎุรรูกุม อิลลา อะซา  ^  วะอี ยุกฺอติลูกุม ยุวัลลูกุมุล อัดบาเราะ ษุมมะ ลา ยุนเศาะรูน
112,ฎุริบัต อฺะลัยฮิมุซ ซิลละตุ อัยนะ มา ษุกฺิฟู อิลลา บิฮับลิม มินัล ลอฮิ วะฮับลิม มินัน นาสิ วะบาอู บิเฆาะเฎาะบิม มินัล ลอฮิ วะฎุริบัต อฺะลัยฮิมุล มัสกะนะฮ์  ^  ซาลิกะ บิอันนะฮุม กานู ยักฟุรูนะ บิอายาติล ลาฮิ วะยักฺตุลูนัล อัมบิยาอะ บิฆ็อยริ ฮักฺกฺ์  ^  ซาลิกะ บิมา อฺะเศอ์า วะกานู ยะอฺ์ตะดูน
113,ลัยสู สะวาอา  ^  มิน อะฮ์ลิล กิตาบิ อุมมะตุน กฺออิมะตุย ยัตลูนะ อายาติล ลาฮิ อานาอัล ลัยลิ วะฮุม ยัสญุดูน
114,ยุอ์มินูนะ บิลลาฮิ วัลเยามิล อาคิริ วะยะอ์มุรูนะ บิลมะอฺ์รูฟิ วะยันเฮานะ อฺะนิล มุนกะริ วะยุสาริอฺูนะ ฟิล ค็อยรอต  ^  วะอุลาอิกะ มินัศ ศอลิฮีน
115,วะมา ยัฟอฺะลู มิน ค็อยริน ฟะลัย ยุกฟะรูฮ์  ^  วัลลอฮุ อฺะลีมุม บิลมุตตะกฺีน
116,อินนัล ละซีนะ กะฟะรู ลัน ตุฆนิยะ อฺันฮุม อัมวาลุฮุม วะลา เอาลาดุฮุม มินัล ลอฮิ ชัยอา  ^  วะอุลาอิกะ อัศฮาบุน นาร  ^  ฮุม ฟีฮา คอลิดูน
117,มะษะลุ มา ยุนฟิกฺูนะ ฟี ฮาซิฮิล ฮะยาติด ดุนยา กะมะษะลิ รีฮิน ฟีฮา ศิรรุน อะศอบัต ฮัรษะ เกฺอ์ามิน เซฺาะละมู อันฟุสะฮุม ฟะอะฮ์ละกัตฮ์  ^  วะมา เซฺาะละมะฮุมุล ลอฮุ วะลากิน อันฟุสะฮุม ยัซฺลิมูน
118,ยาอัยยุฮัล ละซีนะ อามะนู ลา ตัตตะคิซู บิฏอนะตัม มิน ดูนิกุม ลา ยะอ์ลูนะกุม เคาะบาเลา วัดดู มา อฺะนิตตุม กฺ็อด บะดะติล บัฆฎออุ มิน อัฟวาฮิฮิม วะมา ตุคฟี ศุดูรุฮุม อักบัร  ^  กฺ็อด บัยยันนา ละกุมุล อายาต  ^  อิน กุนตุม ตะอฺ์กฺิลูน
119,ฮาอันตุม อุลาอิ ตุฮิบบูนะฮุม วะลา ยุฮิบบูนะกุม วะตุอ์มินูนะ บิลกิตาบิ กุลลิฮี วะอิซา ละกฺูกุม กฺอลู อามันนา วะอิซา เคาะเลา อฺัฎฎู อฺะลัยกุมุล อะนามิละ มินัล ฆ็อยซฺ์  ^  กฺุล มูตู บิฆ็อยซฺิกุม  ^  อินนัล ลอฮะ อฺะลีมุม บิซาติศ ศุดูร
120,อิน ตัมสัสกุม ฮะสะนะตุน ตะสุอ์ฮุม วะอิน ตุศิบกุม สัยยิอะตุย ยัฟเราะฮู บิฮา  ^  วะอิน ตัศบิรู วะตัตตะกฺู ลา ยะฎุรรุกุม กัยดุฮุม ชัยอา  ^  อินนัล ลอฮะ บิมา ยะอฺ์มะลูนะ มุฮีฏ
121,วะอิซ เฆาะเดาตะ มิน อะฮ์ลิกะ ตุเบาวิอุล มุอ์มินีนะ มะกฺออฺิดะ ลิลกฺิตาล  ^  วัลลอฮุ สะมีอฺุน อฺะลีม
122,อิซ ฮัมมัฏ ฏออิฟะตานิ มินกุม อัน ตัฟชะลา วัลลอฮุ วะลีย์ยุฮุมา  ^  วะอฺะลัล ลอฮิ ฟัลยะตะวักกะลิล มุอ์มินูน
123,วะละกฺ็อด นะเศาะเราะกุมุล ลอฮุ บิบัดริว วะอันตุม อะซิลละฮ์  ^  ฟัตตะกฺุล ลอฮะ ละอฺัลละกุม ตัชกุรูน
124,อิซ ตะกฺูลุ ลิลมุอ์มินีนะ อะลัย ยักฟิยะกุม อัย ยุมิดดะกุม ร็อบบุกุม บิษะลาษะติ อาลาฟิม มินัล มะลาอิกะติ มุนซะลีน
125,บะลา  ^  อิน ตัศบิรู วะตัตตะกฺู วะยะอ์ตูกุม มิน เฟาริฮิม ฮาซา ยุมดิดกุม ร็อบบุกุม บิค็อมสะติ อาลาฟิม มินัล มะลาอิกะติ มุเสาวิมีน
126,วะมา ญะอฺะละฮุล ลอฮุ อิลลา บุชรอ ละกุม วะลิตัฏมะอินนะ กฺุลูบุกุม บิฮ์  ^  วะมัน นัศรุ อิลลา มิน อฺินดิล ลาฮิล อฺะซีซิล ฮะกีม
127,ลิยักฺเฏาะอฺะ เฏาะเราะฟัม มินัล ละซีนะ กะฟะรู เอา ยักบิตะฮุม ฟะยันเกฺาะลิบู คออิบีน
128,ลัยสะ ละกะ มินัล อัมริ ชัยอุน เอา ยะตูบะ อฺะลัยฮิม เอา ยุอฺัซซิบะฮุม ฟะอินนะฮุม ซฺอลิมูน
129,วะลิลลาฮิ มา ฟิส สะมาวาติ วะมา ฟิล อัรฎ์  ^  ยัฆฟิรุ ลิมัย ยะชาอุ วะยุอฺัซซิบุ มัย ยะชาอ์  ^  วัลลอฮุ เฆาะฟูรุร เราะฮีม
130,ยาอัยยุฮัล ละซีนะ อามะนู ลา ตะอ์กุลุร ริบา อัฎอฺาฟัม มุฎออฺะฟะฮ์  ^  วัตตะกฺุล ลอฮะ ละอฺัลละกุม ตุฟลิฮูน
131,วัตตะกฺุน นาร็อล ละตี อุอฺิดดัต ลิลกาฟิรีน
132,วะอะฏีอฺุล ลอฮะ วัรเราะสูละ ละอฺัลละกุม ตุรฮะมูน
133,วะสาริอฺู อิลา มัฆฟิเราะติม มิร ร็อบบิกุม วะญันนะติน อฺัรฎุฮัส สะมาวาตุ วัลอัรฎุ อุอฺิดดัต ลิลมุตตะกฺีน
134,อัลละซีนะ ยุนฟิกฺูนะ ฟิส สัรรออิ วัฎฎ็อรรออิ วัลกาซฺิมีนัล ฆ็อยเซฺาะ วัลอฺาฟีนะ อฺะนิน นาส  ^  วัลลอฮุ ยุฮิบบุล มุห์สินีน
135,วัลละซีนะ อิซา ฟะอฺะลู ฟาฮิชะตัน เอา เซฺาะละมู อันฟุสะฮุม ซะกะรุล ลอฮะ ฟัสตัฆฟะรู ลิซุนูบิฮิม วะมัย ยัฆฟิรุซ ซุนูบะ อิลลัล ลอฮุ วะลัม ยุศิรรู อฺะลา มา ฟะอฺะลู วะฮุม ยะอฺ์ละมูน
136,อุลาอิกะ ญะซาอุฮุม มัฆฟิเราะตุม มิร ร็อบบิฮิม วะญันนาตุน ตัจญ์รี มิน ตะห์ติฮัล อันฮารุ คอลิดีนะ ฟีฮา  ^  วะนิอฺ์มะ อัจญ์รุล อฺามิลีน
137,กฺ็อด เคาะลัต มิน กฺ็อบลิกุม สุนะนุน ฟะสีรู ฟิล อัรฎิ ฟันซฺุรู กัยฟะ กานะ อฺากฺิบะตุล มุกัซซิบีน
138,ฮาซา บะยานุล ลินนาสิ วะฮุเดา วะเมาอฺิเซฺาะตุล ลิลมุตตะกฺีน
139,วะลา ตะฮินู วะลา ตะห์ซะนู วะอันตุมุล อะอฺ์เลานะ อิน กุนตุม มุอ์มินีน
140,อี ยัมสัสกุม กฺ็อรฮุน ฟะกฺ็อด มัสสัล เกฺอ์ามะ กฺ็อรฮุม มิษลุฮ์  ^  วะติลกัล อัยยามุ นุดาวิลุฮา บัยนัน นาสิ วะลิยะอฺ์ละมัล ลอฮุล ละซีนะ อามะนู วะยัตตะคิซะ มินกุม ชุฮะดาอ์  ^  วัลลอฮุ ลา ยุฮิบบุซฺ ซฺอลิมีน
141,วะลิยุมะห์ฮิศ็อล ลอฮุล ละซีนะ อามะนู วะยัมฮะกฺ็อล กาฟิรีน
142,อัม ฮะสิบตุม อัน ตัดคุลุล ญันนะตะ วะลัมมา ยะอฺ์ละมิล ลาฮุล ละซีนะ ญาฮะดู มินกุม วะยะอฺ์ละมัศ ศอบิรีน
