id,t
1,ยา สี-น
2,วัลกฺุรอานิล ฮะกีม
3,อินนะกะ ละมินัล มุรสะลีน
4,อฺะลา ศิรอฏิม มุสตะกฺีม
5,ตันซีลัล อฺะซีซิร เราะฮีม
6,ลิตุนซิเราะ เกฺอ์ามัม มา อุนซิเราะ อาบาอุฮุม ฟะฮุม ฆอฟิลูน
7,ละกฺ็อด ฮักฺกฺ็อล เกฺอ์าลุ อฺะลา อักษะริฮิม ฟะฮุม ลา ยุอ์มินูน
8,อินนา ญะอฺัลนา ฟี อะอฺ์นากฺิฮิม อัฆลาลัน ฟะฮิยะ อิลัล อัซกฺอนิ ฟะฮุม มุกฺมะฮูน
9,วะญะอฺัลนา มิม บัยนิ อัยดีฮิม สัดเดา วะมิน ค็อลฟิฮิม สัดดัน ฟะอัฆชัยนาฮุม ฟะฮุม ลา ยุบศิรูน
10,วะสะวาอุน อฺะลัยฮิม อะอันซัรตะฮุม อัม ลัม ตุนซิรฮุม ลา ยุอ์มินูน
11,อินนะมา ตุนซิรุ มะนิต ตะบะอฺัซ ซิกเราะ วะเคาะชิยัร เราะห์มานะ บิลฆ็อยบ์  ^  ฟะบัชชิรฮุ บิมัฆฟิเราะติว วะอัจญ์ริน กะรีม
12,อินนา นะห์นุ นุห์ยิล เมาตา วะนักตุบุ มา กฺ็อดดะมู วะอาษาเราะฮุม  ^  วะกุลละ ชัยอิน อะห์ศ็อยนาฮุ ฟี อิมามิม มุบีน
13,วัฎริบ ละฮุม มะษะลัน อัศฮาบัล กฺ็อรยะติ อิซ ญาอะฮัล มุรสะลูน
14,อิซ อัรสัลนา อิลัยฮิมุษ นัยนิ ฟะกัซซะบูฮุมา ฟะอฺัซซัซนา บิษาลิษิน ฟะกฺอลู อินนา อิลัยกุม มุรสะลูน
15,กฺอลู มา อันตุม อิลลา บะชะรุม มิษลุนา วะมา อันซะลัร เราะห์มานุ มิน ชัยอิน อิน อันตุม อิลลา ตักซิบูน
16,กฺอลู ร็อบบุนา ยะอฺ์ละมุ อินนา อิลัยกุม ละมุรสะลูน
17,วะมา อฺะลัยนา อิลลัล บะลาฆุล มุบีน
18,กฺอลู อินนา ตะฏ็อยยัรนา บิกุม  ^  ละอิล ลัม ตันตะฮู ละนัรญุมันนะกุม วะละยะมัสสันนะกุม มินนา อฺะซาบุน อะลีม
19,กฺอลู ฏออิรุกุม มะอฺะกุม อะอิน ซุกกิรตุม  ^  บัล อันตุม เกฺอ์ามุม มุสริฟูน
20,วะญาอะ มิน อักฺศ็อล มะดีนะติ เราะญุลุย ยัสอฺา กฺอละ ยาเกฺอ์ามิต ตะบิอฺุล มุรสะลีน
21,อิตตะบิอฺู มัล ลา ยัสอะลุกุม อัจญ์เรอ์า วะฮุม มุฮ์ตะดูน
22,วะมา ลิยะ ลา อะอฺ์บุดุล ละซี ฟะเฏาะเราะนี วะอิลัยฮิ ตุรญะอฺูน
23,อะอัตตะคิซุ มิน ดูนิฮี อาลิฮะตัน อี ยุริดนิร เราะห์มานุ บิฎุรริล ลา ตุฆนิ อฺันนี ชะฟาอฺะตุฮุม ชัยเอา วะลา ยุนกฺิซูน
24,อินนี อิซัล ละฟี เฎาะลาลิม มุบีน
25,อินนี อามันตุ บิร็อบบิกุม ฟัสมะอฺูน
26,กฺีลัด คุลิล ญันนะฮ์  ^  กฺอละ ยาลัยตะ เกฺอ์ามี ยะอฺ์ละมูน
27,บิมา เฆาะฟะเราะ ลี ร็อบบี วะญะอฺะละนี มินัล มุกเราะมีน
28,วะมา อันซัลนา อฺะลา เกฺอ์ามิฮี มิม บะอฺ์ดิฮี มิน ญุนดิม มินัส สะมาอิ วะมา กุนนา มุนซิลีน
29,อิน กานัต อิลลา ศ็อยฮะเตา วาฮิดะตัน ฟะอิซา ฮุม คอมิดูน
30,ยาฮัสเราะตัน อฺะลัล อฺิบาด  ^  มา ยะอ์ตีฮิม มิร เราะสูลิน อิลลา กานู บิฮี ยัสตะฮ์ซิอูน
31,อะลัม ยะเรอ์า กัม อะฮ์ลักนา กฺ็อบละฮุม มินัล กฺุรูนิ อันนะฮุม อิลัยฮิม ลา ยัรญิอฺูน
32,วะอิน กุลลุล ลัมมา ญะมีอฺุล ละดัยนา มุห์เฎาะรูน
33,วะอายะตุล ละฮุมุล อัรฎุล มัยตะตุ อะห์ยัยนาฮา วะอัคร็อจญ์นา มินฮา ฮับบัน ฟะมินฮุ ยะอ์กุลูน
34,วะญะอฺัลนา ฟีฮา ญันนาติม มิน นะคีลิว วะอะอฺ์นาบิว วะฟัจญ์ญัรนา ฟีฮา มินัล อฺุยูน
35,ลิยะอ์กุลู มิน ษะมะริฮี วะมา อฺะมิลัตฮุ อัยดีฮิม  ^  อะฟะลา ยัชกุรูน
36,สุบฮานัล ละซี เคาะละกฺ็อล อัซวาญะ กุลละฮา มิมมา ตุมบิตุล อัรฎุ วะมิน อันฟุสิฮิม วะมิมมา ลา ยะอฺ์ละมูน
37,วะอายะตุล ละฮุมุล ลัยลุ นัสละคุ มินฮุน นะฮาเราะ ฟะอิซา ฮุม มุซฺลิมูน
38,วัชชัมสุ ตัจญ์รี ลิมุสตะกฺ็อรริล ละฮา  ^  ซาลิกะ ตักฺดีรุล อฺะซีซิล อฺะลีม
39,วัลเกฺาะมะเราะ กฺ็อดดัรนาฮุ มะนาซิละ ฮัตตา อฺาดะ กัลอฺุรญูนิล เกฺาะดีม
40,ลัช ชัมสุ ยัมบะฆี ละฮา อัน ตุดริกัล เกฺาะมะเราะ วะลัล ลัยลุ สาบิกฺุน นะฮาร  ^  วะกุลลุน ฟี ฟะละกี ยัสบะฮูน
41,วะอายะตุล ละฮุม อันนา ฮะมัลนา ซุรรีย์ยะตะฮุม ฟิล ฟุลกิล มัชฮูน
42,วะเคาะลักฺนา ละฮุม มิม มิษลิฮี มา ยัรกะบูน
43,วะอิน นะชะอ์ นุฆริกฺฮุม ฟะลา เศาะรีเคาะ ละฮุม วะลา ฮุม ยุนเกฺาะซูน
44,อิลลา เราะห์มะตัม มินนา วะมะตาอฺัน อิลา ฮีน
45,วะอิซา กฺีละ ละฮุมุต ตะกฺู มา บัยนะ อัยดีกุม วะมา ค็อลฟะกุม ละอฺัลละกุม ตุรฮะมูน
46,วะมา ตะอ์ตีฮิม มิน อายะติม มิน อายาติ ร็อบบิฮิม อิลลา กานู อฺันฮา มุอฺ์ริฎีน
47,วะอิซา กฺีละ ละฮุม อันฟิกฺู มิมมา เราะซะเกฺาะกุมุล ลอฮุ กฺอลัล ละซีนะ กะฟะรู ลิลละซีนะ อามะนู อะนุฏอฺิมุ มัล เลา ยะชาอุล ลอฮุ อัฏอฺะมะฮู อิน อันตุม อิลลา ฟี เฎาะลาลิม มุบีน
48,วะยะกฺูลูนะ มะตา ฮาซัล วะอฺ์ดุ อิน กุนตุม ศอดิกฺีน
49,มา ยันซฺุรูนะ อิลลา ศ็อยฮะเตา วาฮิดะตัน ตะอ์คุซุฮุม วะฮุม ยะคิศศิมูน
50,ฟะลา ยัสตะฏีอฺูนะ เตาศิยะเตา วะลา อิลา อะฮ์ลิฮิม ยัรญิอฺูน
51,วะนุฟิเคาะ ฟิศ ศูริ ฟะอิซา ฮุม มินัล อัจญ์ดาษิ อิลา ร็อบบิฮิม ยันสิลูน
52,กฺอลู ยาวัยละนา มัม บะอฺะษะนา มิม มัรเกฺาะดินา  ^  ฮาซา มา วะอฺะดัร เราะห์มานุ วะเศาะดะกฺ็อล มุรสะลูน
53,อิน กานัต อิลลา ศ็อยฮะเตา วาฮิดะตัน ฟะอิซา ฮุม ญะมีอฺุล ละดัยนา มุห์เฎาะรูน
54,ฟัลเยามะ ลา ตุซฺละมุ นัฟสุน ชัยเอา วะลา ตุจญ์เซานะ อิลลา มา กุนตุม ตะอฺ์มะลูน
55,อินนะ อัศฮาบัล ญันนะติล เยามะ ฟี ชุฆุลิน ฟากิฮูน
56,ฮุม วะอัซวาญุฮุม ฟี ซฺิลาลิน อฺะลัล อะรออิกิ มุตตะกิอูน
57,ละฮุม ฟีฮา ฟากิฮะตู วะละฮุม มา ยัดดะอฺูน
58,สะลามุน เกฺอ์าลัม มิร ร็อบบิร เราะฮีม
59,วัมตาซุล เยามะ อัยยุฮัล มุจญ์ริมูน
60,อะลัม อะอฺ์ฮัด อิลัยกุม ยาบะนี อาดะมะ อัล ลา ตะอฺ์บุดุช ชัยฏอน  ^  อินนะฮู ละกุม อฺะดูว์วุม มุบีน
61,วะอะนิอฺ์ บุดูนี  ^  ฮาซา ศิรอฏุม มุสตะกฺีม
62,วะละกฺ็อด อะฎ็อลละ มินกุม ญิบิลลัน กะษีรอ  ^  อะฟะลัม ตะกูนู ตะอฺ์กฺิลูน
63,ฮาซิฮี ญะฮันนะมุล ละตี กุนตุม ตูอฺะดูน
64,อิศเลาฮัล เยามะ บิมา กุนตุม ตักฟุรูน
65,อัลเยามะ นัคติมุ อฺะลา อัฟวาฮิฮิม วะตุกัลลิมุนา อัยดีฮิม วะตัชฮะดุ อัรญุลุฮุม บิมา กานู ยักสิบูน
66,วะเลา นะชาอุ ละเฏาะมัสนา อฺะลา อะอฺ์ยุนิฮิม ฟัสตะบะกฺุศ ศิรอเฏาะ ฟะอันนา ยุบศิรูน
67,วะเลา นะชาอุ ละมะสัคนาฮุม อฺะลา มะกานะติฮิม ฟะมัส ตะฏออฺู มุฎีย์เยา วะลา ยัรญิอฺูน
68,วะมัน นุอฺัมมิรฮุ นุนักกิสฮุ ฟิล ค็อลกฺ์  ^  อะฟะลา ยะอฺ์กฺิลูน
69,วะมา อฺัลลัมนาฮุช ชิอฺ์เราะ วะมา ยัมบะฆี ละฮ์  ^  อิน ฮุวะ อิลลา ซิกรู วะกฺุรอานุม มุบีน
70,ลิยุนซิเราะ มัน กานะ ฮัยเยา วะยะฮิกฺกฺ็อล เกฺอ์าลุ อฺะลัล กาฟิรีน
71,อะวะ ลัม ยะเรอ์า อันนา เคาะลักฺนา ละฮุม มิมมา อฺะมิลัต อัยดีนา อันอฺามัน ฟะฮุม ละฮา มาลิกูน
72,วะซัลลัลนาฮา ละฮุม ฟะมินฮา เราะกูบุฮุม วะมินฮา ยะอ์กุลูน
73,วะละฮุม ฟีฮา มะนาฟิอฺุ วะมะชาริบ  ^  อะฟะลา ยัชกุรูน
74,วัตตะเคาะซู มิน ดูนิล ลาฮิ อาลิฮะตัล ละอฺัลละฮุม ยุนเศาะรูน
75,ลา ยัสตะฏีอฺูนะ นัศเราะฮุม วะฮุม ละฮุม ญุนดุม มุห์เฎาะรูน
76,ฟะลา ยะห์ซุนกะ เกฺอ์าลุฮุม  ^  อินนา นะอฺ์ละมุ มา ยุสิรรูนะ วะมา ยุอฺ์ลินูน
77,อะวะ ลัม ยะร็อล อินสานุ อันนา เคาะลักฺนาฮุ มิน นุฏฟะติน ฟะอิซา ฮุวะ เคาะศีมุม มุบีน
78,วะเฎาะเราะบะ ละนา มะษะเลา วะนะสิยะ ค็อลเกฺาะฮ์  ^  กฺอละ มัย ยุห์ยิล อฺิซฺอมะ วะฮิยะ เราะมีม
79,กฺุล ยุห์ยีฮัล ละซี อันชะอะฮา เอาวะละ มัรเราะฮ์  ^  วะฮุวะ บิกุลลิ ค็อลกฺิน อฺะลีม
80,อัลละซี ญะอฺะละ ละกุม มินัช ชะญะริล อัคเฎาะริ นาร็อน ฟะอิซา อันตุม มินฮุ ตูกฺิดูน
81,อะวะ ลัยสัล ละซี เคาะละกฺ็อส สะมาวาติ วัลอัรเฎาะ บิกฺอดิริน อฺะลา อัย ยัคลุเกฺาะ มิษละฮุม  ^  บะลา วะฮุวัล ค็อลลากฺุล อฺะลีม
82,อินนะมา อัมรุฮู อิซา อะรอดะ ชัยอัน อัย ยะกฺูละ ละฮู กุน ฟะยะกูน
83,ฟะสุบฮานัล ละซี บิยะดิฮี มะละกูตุ กุลลิ ชัยอิว วะอิลัยฮิ ตุรญะอฺูน
